<?xml version="1.0" encoding="UTF-8"?>
<paper xmlns:xsi="http://www.w3.org/2001/XMLSchema-instance" xsi:noNamespaceSchemaLocation="../publication_schema.xsd">
	<item>
		<title>New York Times</title>
		<type>газета</type>
		<period>еженедельно</period>
		<characteristic>
			<color>Да</color>
			<volume>1.2</volume>
			<gloss>Да</gloss>
		</characteristic>
		<index>1</index>
	</item>
	
	<item>
		<title>Time</title>
		<type>журнал</type>
		<period>еженедельно</period>
		<characteristic>
			<color>Да</color>
			<volume>1.2</volume>
			<gloss>Да</gloss>
		</characteristic>
	</item>
</paper>